일자,언론사,text,clean_text
20191009,조선일보,건보공단 노조 민노총 집회 불참자 벌금 만원 내라 건강보험공단 노동조합이 상급 단체인 민주노총 집회에 참석하지 않은 조합원들에게 집회 불참비 를 걷어 노조원들 사이에 논란이 일고 있다 건보노조는 민노총 산하 공공운수노조 소속이다 민노총 산하 노조 집행부가 조합원에게 불참비를 걷은 사례가 처음은 아니지만 건보노조의 경우엔 젊은 조합원들을 중심으로 부당한 참석 강요 란 목소리가 확산되면서 일 불참자 건보 공단 노조 민노총 집회 벌금 조합원 중심 참석 강요 건강 보험 공단 노동조합 상급 단체 민주 노총 집회 참석 조합원들 집회 불참비 노조원 사이 논란 건보노조 민노총 산하 공공 운수 노조 소속 민노총 산하 노조 집행부 조합원 불참비 사례 건보노조 조합원들 중심 참석 강요 목소리 확산 일종 세대 갈등 관계자들 건보 노조 관계자 토요일 세종대로 지난달 서울 중구 대정부 교섭 승리 총력 투쟁 선포 대회 참가 건보노조 지부 이날 집회 불참 노조원들 벌금 명목 지부별 불참비 인 만 만 건보노조 만 직원 건보 공단 정규 만 가입 전국 지부 건보 공단 직원 온라인 커뮤니티 불법 동원 불참 목소리 불참비 사정 불참 목소리 표출 건보 공단 관계자 조합원 위주 불만 표시 직원들 건보 공단 내부 노조 임금 협상 노조원 관심사 집회 참석 강요 불만 건보공단 만 공공 기관 노조원 주최 추산 참석 지난달 민노총 집회 공공 공공 정규 철폐 구호 건보공단 직원 노조 직원들 월급 인상 비정규직 정규직화 이상적 주장 내부 갈등 건보노조 집회 불참비 노조 설립 전통 일괄적 기준 지부들 자발적 교수 김태기 단국대 조합원 의견 일관 기준 불참비 노동조합 횡포 건보공단 불참비 노조원 건보노조 조합원 민노총 조합원들 만 노동조합 관계자 비정규직 직원들 노조원들 김태기 중구 단국대 만 서울,건보 공단 노조 민노총 집회 불참 벌금 만원 건강 보험 공단 노동조합 상급 노총 집회 참석 조합원 집회 불참 노조 사이 논란 보노 민노총 운수 노조 소속 민노총 노조 집행 부가 조합원 불참 사례 처음 보노 경우 조합원 중심 참석 강요 목소리 확산 불참 건보 공단 노조 민노총 집회 벌금 조합원 중심 참석 강요 건강 보험 공단 노동조합 상급 노총 집회 참석 조합원 집회 불참 노조 사이 논란 보노 민노총 공공 운수 노조 소속 민노총 노조 집행 조합원 불참 사례 보노 조합원 중심 참석 강요 목소리 확산 일종 세대 갈등 건보 노조 토요일 세종 중구 교섭 승리 총력 투쟁 선포 대회 참가 보노 지부 집회 불참 노조 벌금 명목 부별 불참 보노 직원 건보 공단 정규 가입 지부 건보 공단 직원 온라인 커뮤니티 불법 동원 불참 목소리 불참 불참 목소리 건보 공단 조합원 위주 불만 표시 직원 건보 공단 내부 노조 임금 협상 노조 관심사 집회 참석 강요 불만 건보 공단 공공 노조 주최 추산 참석 민노총 집회 공공 공공 정규 철폐 구호 건보 공단 직원 노조 직원 월급 비정규직 정규직 주장 내부 갈등 보노 집회 불참 노조 설립 전통 일괄 기준 부들 자발 교수 김태기 단국대 조합원 일관 기준 불참 노동조합 횡포 건보 공단 불참 노조 보노 조합원 민노총 조합원 노동조합 비정규직 직원 노조 김태기 중구 단국대
20190515,조선일보,김동섭의 아웃룩 삑 세대와 삐빅 세대의 악수 지하철 개찰구에서 승차권을 대는 모습을 보면 삑 과 삐빅 이라는 두 가지 소리가 들린다 삑 은 세 이하 승객이 갖고 있는 승차권 소리다 삐빅 은 세 이상의 승차권에서 나오는 소리다 이 소리와 동시에 개찰구 화살표 밑에도 빨간 줄이 뜬다 지하철 역무원들이 제값 내지 않고 경로 우대 승차권을 사용하는 사람들을 찾아내기 위해 만든 방법이 세대 세대 악수 내년 전후 세대 노인 진입 년 넘어 노인 국민연금 노령연금 건강보험 사회 파열음 세대 갈등 연장 대선 정년 이슈 청년 노동 개혁 지하철 개찰구 승차권 모습 삐빅 가지 소리 세 승객 승차권 소리 세 승차권 소리 소리 동시 개찰구 화살표 지하철 역무원 제값 승차권 경로 우대 사용 사람들 방법 경로 우대증 세대 선배 지하철 마음 불편 노인 표시 심판 축구 경기 레드 카드 승차 노인 무료 승차 신호 법원 노동 가동 세 세 인정 결정 노인 연령 주장 대표 대상 노인 지하철 무임승차 지하철공단 노인복지법 제도 노인 무임승차 적자 하소연 복지부 얼마 노인 얼마 정액 외래 진료비 할인 제도 대상 세 연령 증가 노인 의료비 감당 소득 노인들 진료비 노인들 반발 베이비부머 내년 진입 세대 세대 잠재 갈등 표면 시작 사회 내년 시대 집단 고령 갈등 한국전쟁 시작 베이비부머 년 만 내년 세 진입 년 노인 인구 만 수명 세 예상 수명 예상 세 노인복지법 년 세 년 일손 사회보장제도 사람 급증 병원 시설 노인 요양 건강보험 국민연금 위기 재정 고갈 부담 세대 갈등 간병 부담 노인 간병비 가족 다툼 가족 사람 혜택 사람 사회 사회 거리 세대 노인 운동장 파열음 노인 세대 사회 안전망 지적 정년 세 국민연금 세 년 살씩 년 세 국민연금 나이 정년 조정 정년 연금 나이 퇴직 공백기 연금 최장 공백기 노후 연금 반발 공무원 교직원들 세 연금 국민연금 불리 불만 년 정년 연장 논의 조정 노인 연령 금단 열매 당장 내년 총선 대선 코앞 노인 소리 조정 노인 연령 칼날 정치인 조정 노인 연령 정년 연장 해결 목소리 생산 연령 세 인구 년 만 년 만 생산 현장 일손 부족 위기 빈자리 대체 교수 데이비드 콜먼 영국 옥스퍼드대 고령 위기 국가 소멸 한국 이민 정도 청년 세대 취업난 정년 연장 년 취업 연령 인구 후반 시작 논의 정년 연장 가능성 대선 정년 연장 이슈 등장 가능성 선임연구위원 김승택 한국노동연구원 선임 위원 각종 선거 실행 여부 대 세 쟁점 만큼 선거 부각 실제 유권자 차지 유권자 비율 총선 명꼴 년 대선 대선 년 명꼴 정년 연장 나이 해결 국민연금 나이 퇴직 정년 연장 임금피크제 기업 현실 부담 청년층 정규직 진입 정년 사람들 정규 형태 일자리 기회 지하철 승차권 개찰구 경고음 소리 세대 세대 악수 일자리 세 세 승차권 국민연금 개찰구 진료비 무임승차 유권자 일자리 한국 명꼴 만 베이비부머 공백기,김동섭 아웃룩 세대 삐빅 세대 악수 지하철 개찰구 승차권 모습 삐빅 가지 소리 이하 승객 승차권 소리 삐빅 승차권 소리 소리 동시 개찰구 화살표 지하철 역무 내지 경로 우대 승차권 사용 방법 세대 세대 악수 전후 세대 진입 국민연금 노령 연금 건강 보험 사회 파열음 세대 갈등 연장 정년 이슈 청년 노동 개혁 지하철 개찰구 승차권 모습 삐빅 가지 소리 승객 승차권 소리 승차권 소리 소리 동시 개찰구 화살표 지하철 역무 승차권 경로 우대 사용 방법 경로 우대 세대 선배 지하철 마음 불편 표시 축구 경기 레드 카드 승차 무료 승차 신호 법원 노동 가동 인정 연령 주장 지하철 무임 승차 지하철 공단 복지 무임 승차 적자 하소연 복지부 얼마 얼마 정액 외래 진료 할인 연령 증가 의료 감당 소득 진료 반발 베이비부머 진입 세대 세대 잠재 갈등 표면 사회 시대 집단 고령 갈등 베이비부머 진입 인구 수명 예상 수명 예상 복지 일손 사회보장 급증 병원 시설 요양 건강 보험 국민연금 위기 재정 고갈 세대 갈등 간병 간병 다툼 혜택 사회 사회 거리 세대 운동장 파열음 세대 사회 안전 정년 국민연금 국민연금 나이 정년 조정 정년 연금 나이 퇴직 공백기 연금 공백기 노후 연금 반발 교직원 연금 국민연금 불리 불만 정년 연장 조정 연령 금단 열매 당장 총선 코앞 소리 조정 연령 칼날 정치인 조정 연령 정년 연장 해결 목소리 생산 연령 인구 생산 현장 일손 부족 위기 빈자리 대체 교수 데이비드 영국 옥스퍼드대 고령 위기 소멸 이민 정도 청년 세대 취업 정년 연장 취업 연령 인구 후반 정년 연장 가능성 정년 연장 이슈 등장 가능성 연구 김승택 노동 각종 실행 여부 쟁점 만큼 부각 실제 유권자 차지 유권자 비율 총선 명꼴 명꼴 정년 연장 나이 해결 국민연금 나이 퇴직 정년 연장 임금 기업 현실 청년 정규직 진입 정년 정규 형태 일자리 기회 지하철 승차권 개찰구 고음 소리 세대 세대 악수 일자리 승차권 국민연금 개찰구 진료 무임 승차 유권자 일자리 명꼴 베이비부머 공백기
20190408,조선일보,최보식이 만난 사람 다음 정부에 미루는 연금 개혁 폭탄 돌리기 이대로면 분명 폭발해 강원 산불이 발생하기 전까지 지난주 가장 암울한 국내 소식은 눈덩이처럼 불어난 연금 충당 부채 조원 에 관한 것이었다 작년 국가 부채가 조 억원으로 급증한 것은 공무원과 군인에게 줘야 할 연금이 년 이후 해마다 조원 이상 늘어난 게 주원인이었다 년 재직 기간 내내 연금 업무만 해왔던 최재식 정부 폭탄 연금 개혁 폭발 연금 빚더미 최재식 최재식 공무원 연금 공단 이사장 강원 산불 발생 지난주 암울 소식 눈덩이 연금 충당 부채 국가 부채 조 급증 공무원 군인 연금 년 조 주원인 기간 재직 연금 업무 최재식 공무원 연금 관리 공단 이사장 공무원연금 년 적자 적립금 자체 연금 지급 공무원들 보전 정부 조항 정부 적자 보전 명문화 보험료 지급률 동의 개혁 연금 제도 반대 정책 결정권자 생각 정치권 연금국 총무처 공무원 생활 시작 공무원 연금 공단 신설 창립 멤버 공무원연금연구센터장 연금관리실장 전략기획실장 연금사업본부장 출신 공단 내부 이사장 퇴직 공무원연금 년 상태 만성 적자 개혁 연금 수급 개시 연령 년 연동률 연금 수급액 연동 봉급 인상 물가 인상 공무원 자신 연금 셀프 개혁 평가 년 국회 주도 논의 초안 연금 개혁 공무원 집단 반발 미봉책 보험료 수익비 대비 배 수급자 연금 인상 년 동결 완벽 개혁 과거 진전 개혁 개혁 부채 연금 충당 조 조 적자 세금 지급률 보험료 기간 과거 지급 보장 약속 소급 적용 약속 지급 보장 세대 동의 이론적 과거 약속 파기 연금 세대 재정 적자 해결 연금 개혁 세대 형평성 세대 형평 세대 불리 딜레마 마당 정권 공무원 만 증원 단기적 연금 적립금 플러스 연금 지급 부담 미래 정권 생각 공무원 박봉 연금 보전 민간 기업 정부 평균 연봉 공무원 민간 보험료 조 조 원씩 세금 보전 국민연금 연금 지급 정상 국민 연금 보험료 개인 사용자 공무원 보험료 개인 정부 국민연금 과거 공무원연금 수익비 배 배 국민연금 배 지속 가능 국민 세금 공무원연금 국민연금 통합 의견 시행 제도 혼란 미국 연방 공무원 연금 사회보장연금 통합 임용 공무원 적용 공무원 연금 지급 세금 해결 년 개혁 방안 검토 채택 보험료 지급액 조정 대공사 상태 보수 현실적 방안 당장 정부 재정 부담 정치 지도자 자신 임기 허리띠 선택 조정 근본 해결 세월 악화 공무원연금 년 적자 수익비 군인연금 형편 군인연금 가입자 상대적 만 주목 년 적자 국방부 예산 직업 특수 개혁 사학연금 사학연금 공무원연금 구조 년 가입자 만 명쯤 학령 인구 교직원 급감 연금 수급자 보험료 사람 사학연금 파탄 예정 코스 사학연금 국민 세금 연금 총체적 부실 덩어리 고령 사회 원인 공무원연금 수명 평균 세 초기 연금 지출 기금 적립 평균 수명 세 년 년 연금 년 장수 사람들 축복 사회적 숙제 퇴직 사회 구조 연금 수급자 양산 경제성장 일자리 청년 실업난 정년 세대 갈등 인구 노동력 요즘 은퇴자 연금 노후 부실 연금 작동 공무원연금 공무원 연금 암울 재정 추계 보고 내년 전망 뒷날 상황 걱정 정권 임기 세대 부담 자신 대통령 국민 연금 운용 국민 눈높이 생각 보험료 소득 대체 국민 눈높이 재정 부담 세대 눈높이 세대 사기 대통령 보험료 연금 묘책 연금 조금 사람 불가능 하늘 결국 세금 연금 방법 대통령 보험료 개혁안 전면 지시 복지부 장관 치열 그중 현행 유지 시점 국민 연금 고갈 년 보험료 나중 사태 발생 대통령 속도 연금 고갈 정부 보장 연금 지급 세대 년 정부 보험료 연금 조정 해결 보험료 납부자 부담 보험료 인상 한계선 연금 지급 노후 대책 용돈 정권 역대 정권 정면 해결 정부 폭탄 시점 폭발 폭발 연금 수급자 기금 고갈 시점 보험료 똥바가지 세대 사람 연금 제도 파탄 국민 연금 공단 이사장 낙하산 정치인 출신 기금운용본부장 공석 수익률 연금 운용 수익 마이너스 연금 운용 전문가 공단 이사장 정치 개입 국민 연금 운용 재무적 투자 주가 바람 운용 수익 마이너스 국민연금공단 전주 전문가들 연금 운용 전문가 지방 현실적 금융 큰돈 국민연금공단 투자 기업 의결권 행사 스튜어드십 코드 채택 얼마 사회적 박수 여 영국 스튜어드십 코드 일종 경영 개입 그림 기업 경영 개선 수익 정치적 악용 대통령 연금 적립금 정의 사회 변질 위험 연금 운용 정치 독립 철저 수익 입장 보험료 공무원 이사장 국민연금 공무원연금 최재식 수익비,최보 식이 만난 다음 연금 개혁 폭탄 분명 폭발 강원 산불 지난주 가장 국내 소식 눈덩이 불어 연금 충당 부채 조원 작년 부채 억원 급증 군인 연금 이후 조원 원인 재직 기간 내내 연금 업무 최재 폭탄 연금 개혁 폭발 연금 더미 최재 최재 연금 공단 이사장 강원 산불 지난주 소식 눈덩이 연금 충당 부채 부채 급증 군인 연금 주원 기간 재직 연금 업무 최재 연금 관리 공단 이사장 연금 적자 적립금 자체 연금 지급 보전 조항 적자 보전 명문 보험료 지급 동의 개혁 연금 반대 정권 생각 정치권 연금 총무처 생활 연금 공단 신설 창립 멤버 연금 연구 센터 연금 관리 실장 전략기획 실장 연금 사업 본부장 출신 공단 내부 이사장 퇴직 연금 상태 만성 적자 개혁 연금 수급 개시 연령 연동 연금 수급 연동 봉급 물가 자신 연금 셀프 개혁 주도 초안 연금 개혁 집단 반발 봉책 보험료 익비 대비 수급 연금 동결 완벽 개혁 과거 진전 개혁 개혁 부채 연금 충당 적자 세금 지급 보험료 기간 과거 지급 보장 약속 소급 적용 약속 지급 보장 세대 동의 이론 과거 약속 파기 연금 세대 재정 적자 해결 연금 개혁 세대 형평성 세대 형평 세대 불리 딜레마 마당 정권 증원 기적 연금 적립금 플러스 연금 지급 미래 정권 생각 박봉 연금 보전 민간 기업 평균 연봉 민간 보험료 세금 보전 국민연금 연금 지급 정상 국민 연금 보험료 개인 사용자 보험료 개인 국민연금 과거 연금 익비 국민연금 지속 가능 국민 세금 연금 국민연금 통합 시행 혼란 미국 연방 연금 사회보장 연금 통합 임용 적용 연금 지급 세금 해결 개혁 검토 채택 보험료 지급 조정 공사 상태 현실 당장 재정 정치 지도자 자신 임기 허리띠 선택 조정 근본 해결 세월 악화 연금 적자 익비 군인 연금 형편 군인 연금 가입자 상대 적자 국방부 직업 특수 개혁 사학 연금 사학 연금 연금 구조 가입자 학령 인구 교직원 급감 연금 수급 보험료 사학 연금 파탄 예정 코스 사학 연금 국민 세금 연금 체적 부실 덩어리 고령 사회 원인 연금 수명 평균 초기 연금 지출 기금 적립 평균 수명 연금 장수 축복 사회 숙제 퇴직 사회 구조 연금 수급 양산 경제성장 일자리 청년 실업난 정년 세대 갈등 인구 노동 요즘 은퇴 연금 노후 부실 연금 작동 연금 연금 재정 추계 보고 전망 뒷날 상황 걱정 정권 임기 세대 자신 국민 연금 운용 국민 눈높이 생각 보험료 소득 대체 국민 눈높이 재정 세대 눈높이 세대 사기 보험료 연금 묘책 연금 조금 불가능 하늘 세금 연금 방법 보험료 개혁 전면 지시 복지부 치열 현행 유지 시점 국민 연금 고갈 보험료 나중 사태 속도 연금 고갈 보장 연금 지급 세대 보험료 연금 조정 해결 보험료 납부 보험료 한계 연금 지급 노후 용돈 정권 역대 정권 정면 해결 폭탄 시점 폭발 폭발 연금 수급 기금 고갈 시점 보험료 바가지 세대 연금 파탄 국민 연금 공단 이사장 낙하산 정치인 출신 기금 운용 본부장 공석 수익률 연금 운용 수익 마이너스 연금 운용 전문가 공단 이사장 정치 개입 국민 연금 운용 재무 투자 주가 바람 운용 수익 마이너스 국민연금 공단 전주 전문가 연금 운용 전문가 현실 금융 국민연금 공단 투자 기업 의결권 행사 스튜어드 코드 채택 얼마 사회 박수 영국 스튜어드 코드 일종 경영 개입 그림 기업 경영 개선 수익 정치 악용 연금 적립금 정의 사회 변질 위험 연금 운용 정치 독립 철저 수익 보험료 이사장 국민연금 연금 최재 익비
20190128,한국일보,단독 국민 가 문 정부서 사회갈등 늘었다 한국인 공공갈등 의식조사 년엔 배 넘게 증가 정부 갈등 해소노력 부족 갈등 심각성 노사 빈부 이념 남녀갈등 심각 지역갈등 넘어 문재인 정부 들어 갈등이 심화하고 있지만 해결 노력은 부족하다고 느끼는 국민의 따가운 시선이 여론조사에서 확인됐다 국민의 절반 이상 이 이번 정부 내에서 사 국민 정부 사회갈등 한국인 공공 갈등 의식 조사 년 증가 부족 정부 갈등 해소 노력 갈등 노사 빈부 이념 남녀 갈등 지역갈등 문재인 정부 갈등 심화 해결 노력 부족 국민 시선 여론조사 확인 국민 절반 정부 사회 갈등 인식 절반 가까이 정부 노력 갈등 해소 부족 응답 노사 세대 지역 갈등 지역 미투 운동 격화 남녀 갈등 사회 갈등 요인 부상 정부 사회 갈등 인식 증가 감안 젠더 갈등 집권 정책 문재인 정부 갈등 한국리서치 한국사회갈등해소센터 일 예정 한국인 공공 갈등 의식 조사 응답자 명 사회 집단 갈등 집단 문재인 정부 갈등 지적 년 동일 조사 갈등 응답자 비교 년 부정 의견 정부 갈등 답변 급감 정부 갈등 관리 능력 평가 악화 정부 갈등 해소 노력 응답 노력 응답 포인트 년 조사 응답 차이 응답 포인트 정부 갈등 관리 능력 비판 인식 결과 전문가들 정부 과거 보수 행보 국민 실망 결과 해석 최창렬 용인대 정치학 교수 년 문재인 정부 국정 농단 세력 단죄 진행 국민 불만 분배구조 악화 사회 각층 갈등 표출 평가 조사 총괄 소장 이강원 한국 사회 갈등 해소 센터 국무조정실 정권 갈등 관리 컨트롤 타워 과거 정부 비교 제도 정부 갈등 제어 미비 지적 노사 세대 갈등 남녀갈등 분출 사회 노사 갈등 갈등 갈등 평가 항목 경영자 노동자 갈등 응답 최저 임금 인상 단축 법정 근로 시간 시행 노사 갈등 본격적 심화 노사 갈등 년 조사 년 상승세 연속 소폭 하락 년 정도 순위 차지 사무처장 윤순철 경실련 정부 과거 보수 노동계 요구들 동시다발적 측면 간과 노사 입장 조율 양쪽 반발 예상 정책 정부 책임 갈등 요인 남녀 갈등 분출 현상 확인 조사 남녀 갈등 남녀 상승 전국 강타 미투 운동 홍대 누드모델 몰카 사건 촉발 혜화역 시위 젠더 갈등 전면 부상 신광영 중앙대 사회학 교수 일베 웹사이트 여성 혐오 대항 워마드 남성 혐오 커뮤니티 등장 남녀 갈등 구도 인터넷상 댓글 정치 결합 혐오감정 결집 폭발 조건 집단 갈등 집단 여론 회의적 명 명 집단 갈등 집단 사회발전 부정적 측면 집단 갈등 집단 사회발전 발생 현상 응답 비율 방안 갈등 해소 공론 법제 사회 만연 갈등 해소 방안 공론 절차 활용 의견 우호적 공론화 책임 회피 수단 남용 회의 응답 응답자 공론화 행정 신뢰도 숙의 민주주의 기여 의견 동의 문재인 정부 공론 절차 신고리 원전 개편 대입 제도 집단 사이 이해 갈등 해결 경험 작용 전문가들 공론 절차 갈등 해소 활용 조언 대외부원장 은재호 한국행정연구원 표준화 기준 공론화 정치적 이용 불신 지적 공론 절차 법제화 여론 응답자 법제 공감 공론 여부 결정 형태 응답자 일정 여건 구비 국민 제안 결정 응답 정부 공공기관 결정 응답 국민 제안 응답 한참 이강원 소장 갈등 상황 체계적 관리 법적 상태기 공론화 법제화 최우선 책임 정부 국회 법제화 여론조사 전국 세 대상 응답자 주민 등록 인구 현황 성별 연령 지역별 비례 한국리서치 응답자 추출 표본오차 신뢰 수준 포인트 응답자 공론화 문재인 법제화 이강원 한국리서치,단독 국민 사회 갈등 한국인 갈등 의식 증가 갈등 해소 노력 부족 갈등 심각 노사 빈부 이념 남녀 갈등 심각 갈등 갈등 심화 해결 노력 국민 시선 확인 국민 절반 국민 사회 갈등 한국인 공공 갈등 의식 증가 부족 갈등 해소 노력 갈등 노사 빈부 이념 남녀 갈등 갈등 갈등 심화 해결 노력 부족 국민 시선 확인 국민 절반 사회 갈등 인식 절반 가까이 노력 갈등 해소 부족 응답 노사 세대 갈등 미투 운동 격화 남녀 갈등 사회 갈등 요인 부상 사회 갈등 인식 증가 감안 젠더 갈등 집권 갈등 리서치 사회 갈등 해소 센터 예정 한국인 공공 갈등 의식 응답 사회 집단 갈등 집단 갈등 동일 갈등 응답 비교 부정 갈등 답변 급감 갈등 관리 능력 악화 갈등 해소 노력 응답 노력 응답 포인트 응답 차이 응답 포인트 갈등 관리 능력 비판 인식 결과 전문가 과거 행보 국민 실망 결과 해석 최창렬 용인대 정치학 교수 국정 농단 세력 단죄 진행 국민 불만 분배 구조 악화 사회 각층 갈등 총괄 소장 이강원 사회 갈등 해소 센터 국무조정실 정권 갈등 관리 컨트롤 타워 과거 비교 갈등 제어 미비 노사 세대 갈등 남녀 갈등 분출 사회 노사 갈등 갈등 갈등 항목 경영 노동자 갈등 응답 최저 임금 단축 법정 근로 시행 노사 갈등 본격 심화 노사 갈등 상승세 연속 하락 정도 순위 차지 사무 윤순 경실련 과거 노동계 다발 측면 간과 노사 조율 양쪽 반발 예상 책임 갈등 요인 남녀 갈등 분출 현상 확인 남녀 갈등 남녀 상승 강타 미투 운동 홍대 누드모델 몰카 촉발 혜화역 시위 젠더 갈등 전면 부상 광영 중앙대 교수 일베 웹사이트 여성 혐오 대항 워마드 남성 혐오 커뮤니티 등장 남녀 갈등 구도 인터넷 댓글 정치 결합 혐오 감정 결집 폭발 조건 집단 갈등 집단 여론 집단 갈등 집단 사회 발전 부정 측면 집단 갈등 집단 사회 발전 현상 응답 비율 갈등 해소 공론 법제 사회 갈등 해소 공론 절차 활용 우호 공론 책임 회피 수단 남용 응답 응답 공론 행정 신뢰 숙의 민주주의 기여 동의 공론 절차 신고리 원전 개편 대입 집단 사이 이해 갈등 해결 경험 작용 전문가 공론 절차 갈등 해소 활용 조언 대외 부원장 재호 행정 표준화 기준 공론 정치 이용 불신 공론 절차 제화 여론 응답 법제 공감 공론 여부 형태 응답 일정 여건 구비 국민 제안 응답 공공기관 응답 국민 제안 응답 한참 이강원 소장 갈등 상황 체계 관리 법적 상태 공론 제화 우선 책임 제화 응답 주민 등록 인구 현황 성별 연령 지역별 비례 리서치 응답 추출 표본 오차 신뢰 수준 포인트 응답 공론 제화 이강원 리서치
